{
  "schema_version": 1,
  "sprint_id": "sprint-20260807T210015466011Z",
  "problem": "C",
  "agent_mode": "parallel",
  "max_agents": 1,
  "status": "MERGED",
  "created_at_utc": "2026-08-07T21:00:15.466011+00:00",
  "deadline_utc": "2026-08-10 20:00:00+08:00",
  "state_input": {
    "path": "state/decision_log.json",
    "sha256": "734f3c89fdd9d6ab5e004f7360061b2a6f3d48f46e6fbcd06f22cf97a7426fa4"
  },
  "protected_snapshot": [
    {
      "path": "state/decision_log.json",
      "kind": "file",
      "exists": true,
      "sha256": "734f3c89fdd9d6ab5e004f7360061b2a6f3d48f46e6fbcd06f22cf97a7426fa4"
    },
    {
      "path": "results/C/claims.json",
      "kind": "file",
      "exists": true,
      "sha256": "ea9ffef1ec03131a92ee93a1f8dd65eca8b61946487d3ec64efc9d987447300f"
    },
    {
      "path": "paper/main.tex",
      "kind": "file",
      "exists": true,
      "sha256": "c696b1f7e378cea391b7f8bf1704f431bf59b4a336090e563fe47a19bffcf77f"
    },
    {
      "path": "paper/figure_contracts.yaml",
      "kind": "file",
      "exists": true,
      "sha256": "4ea0362eaed0898d6b54403ae79f0217bbc659534884f51c0bfad9e8c620d2db"
    },
    {
      "path": "output",
      "kind": "directory",
      "exists": true,
      "sha256": "8696f16cfdd5e503c1a1d1ee5009a9f93509ab1ffe27950158f2b285bbd7264a"
    }
  ],
  "task_files": [
    "sprints/sprint-20260807T210015466011Z/tasks/solver-q4.json"
  ],
  "root_only_paths": [
    "state/decision_log.json",
    "results/C/claims.json",
    "paper/main.tex",
    "paper/figure_contracts.yaml",
    "output/"
  ],
  "profile": "default",
  "question": "Q4",
  "input_sprint_id": "sprint-20260807T204831936626Z",
  "last_merge_report": "sprints/sprint-20260807T210015466011Z/merge_report.json"
}
