{
  "schema_version": 1,
  "sprint_id": "sprint-20260807T161902915769Z",
  "problem": "C",
  "agent_mode": "parallel",
  "max_agents": 2,
  "status": "PARTIAL",
  "created_at_utc": "2026-08-07T16:19:02.915769+00:00",
  "deadline_utc": "2026-08-10 20:00:00+08:00",
  "state_input": {
    "path": "state/decision_log.json",
    "sha256": "734f3c89fdd9d6ab5e004f7360061b2a6f3d48f46e6fbcd06f22cf97a7426fa4"
  },
  "protected_snapshot": [
    {
      "path": "state/decision_log.json",
      "kind": "file",
      "exists": true,
      "sha256": "734f3c89fdd9d6ab5e004f7360061b2a6f3d48f46e6fbcd06f22cf97a7426fa4"
    },
    {
      "path": "results/C/claims.json",
      "kind": "file",
      "exists": true,
      "sha256": "ea9ffef1ec03131a92ee93a1f8dd65eca8b61946487d3ec64efc9d987447300f"
    },
    {
      "path": "paper/main.tex",
      "kind": "file",
      "exists": true,
      "sha256": "b23c057187c2b666b75b72995b42b46fb06d8c0bea21a988c3e066bb7c249f88"
    },
    {
      "path": "paper/figure_contracts.yaml",
      "kind": "file",
      "exists": true,
      "sha256": "c5247f5a26fb971654a8ee89d7af7e96a7177e613993aef178a9ffe1bbf1fa69"
    },
    {
      "path": "output",
      "kind": "directory",
      "exists": true,
      "sha256": "aeeda0ef74312c43eb08d1f78defb7b556feb9e30ebb6732dab824a80265a907"
    }
  ],
  "task_files": [
    "sprints/sprint-20260807T161902915769Z/tasks/writer-q1.json",
    "sprints/sprint-20260807T161902915769Z/retry/reviewer-q1-attempt-2.json"
  ],
  "root_only_paths": [
    "state/decision_log.json",
    "results/C/claims.json",
    "paper/main.tex",
    "paper/figure_contracts.yaml",
    "output/"
  ],
  "profile": "q1-compose",
  "question": "Q1",
  "input_sprint_id": "sprint-20260807T130848306634Z",
  "last_merge_report": "sprints/sprint-20260807T161902915769Z/merge_report.json"
}
